<?xml version="1.0" encoding="UTF-8"?>

<employee   xmlns="https://www.ilya.ivanov.com/archive/employee"
            xmlns:xsi="http://www.w3.org/2001/XMLSchema-instance"
            xsi:schemaLocation="https://www.ilya.ivanov.com/archive/employee xsd/employee.xsd"
            id="1">
    <employeeMeta>
        <firstName>Ilya</firstName>
        <middleName>Petrovich</middleName>
        <lastName>Ivanov</lastName>
    </employeeMeta>
    <sex>male</sex>
    <age>19</age>
    <workplace>bsuir</workplace>
    <experience>2</experience>
</employee>